question_id,question_text,question_type,options_json,required,display_order
overall_match,"Overall, how well does this image match the query?",single_choice,"{""1"":""Clearly not a match"",""2"":""Mostly not a match"",""3"":""Mostly a match"",""4"":""Clearly a match""}",1,1
greenery_level,"How much greenery is visible in the image?",single_choice,"{""1"":""Very little or none"",""2"":""Limited greenery"",""3"":""Quite a bit of greenery"",""4"":""A lot of greenery""}",1,2
quiet_reading,"Based on visible cues, does this place appear quiet enough for outdoor reading?",single_choice,"{""1"":""Clearly not quiet enough"",""2"":""Probably not quiet enough"",""3"":""Probably quiet enough"",""4"":""Clearly quiet enough""}",1,3
safe_comfortable,"Based on visible cues, does this place appear reasonably safe and comfortable for sitting and reading outdoors?",single_choice,"{""1"":""Clearly not safe/comfortable"",""2"":""Probably not safe/comfortable"",""3"":""Probably safe/comfortable"",""4"":""Clearly safe/comfortable""}",1,4
comment,"Optional comment",text,"{}",0,5